Review,Rating
当年的奥斯卡颁奖礼上，被如日中天的《阿甘正传》掩盖了它的光彩，而随着时间的推移，这部电影在越来越多的人们心中的地位已超越了《阿甘》。每当现实令我疲惫得产生无力感，翻出这张碟，就重获力量。毫无疑问，本片位列男人必看的电影前三名！回顾那一段经典台词：“有的人的羽翼是如此光辉，即使世界上最黑暗的牢狱，也无法长久地将他围困！”,5
恐惧让你沦为囚犯，希望让你重获自由。——《肖申克的救赎》,5
"“这是一部男人必看的电影。”人人都这么说。但单纯从性别区分，就会让这电影变狭隘。《肖申克的救赎》突破了男人电影的局限，通篇几乎充满令人难以置信的温馨基调，而电影里最伟大的主题是“希望”。
当我们无奈地遇到了如同肖申克一般囚禁了心灵自由的那种囹圄，我们是无奈的老布鲁克，灰心的瑞德，还是智慧的安迪？运用智慧，信任希望，并且勇敢面对恐惧心理，去打败它？
经典的电影之所以经典，因为他们都在做同一件事——让你从不同的角度来欣赏希望的美好。",5
策划了19年的私奔……,5
关于希望最强有力的注释。,5
有种鸟是关不住的.,5
"超级喜欢超级喜欢,不看的话人生不圆满.",5
"Fear Can Hold You Prisoner, Hope Can Set You Free",5
这样的男人谁会舍得背叛。。。,5
"一部没有爱情与美女的电影,却光芒四射",5
"因为1994年台湾引进了一部比较卖座的老片The Sting，被错译成了《刺激》。到了1995年本片上映时，片商觉得其剧情与《刺激》有类似的地方（大概都属于高智商的复仇？），因此被译成了《刺激1995》，1998年又有一部片子Return To Paradise因为含有牢狱情节，被译成《刺激1998》！

说起来，自打高一时看过《肖申克的救赎》，男主角安迪的精神就持续影响着我，成为我价值观的一部分。那种持续不断给有关机构写信申请图书馆的精神，那种拒绝“忙着活，忙着死”的人生的精神，那种迫不得已作恶却良心不泯正义终彰的精神，那种享受生命中每一刻微小的美好的精神，那种在困境中梦想着远方有一小块属于自己乐土的精神，那种甘于平凡且活得自在的精神。一言以蔽之，那种属于“人性的光辉”的精神。",5
"“你知道，有些鸟儿是注定不会被关在牢笼里的，它们的每一片羽毛都闪耀着自由的光辉。”
一部经得起时间检验的电影，豆瓣、时光网、IMDb各大电影网站都排名第一的电影。",5
没有人会不喜欢吧！书和电影都好。,5
还记得老brooks上吊自杀时心里有多难过。自由来的太晚，生命早已自行放弃。,5
人的生命不过是从一个洞穴通往另一个世界..然后在那个世界的雨中继续颤抖.i hope,4
一部没有女主，没有爱情，没有特技的好片子，也是很多大学英语老师喜欢放给学生看的片子，这部片子讲诉的就是一个很纯粹的故事，一次的救赎，换回了自由，也是一种信念驱使他这么做，这部片子是感人的，它也让很多人成长。,5
肖申克中生存体制又如当今社会体制，“痛改前非”的人一次次被重新投入黑暗之中，当权者干着肮脏的勾当却会在公众面前宣讲“拯救之道”，似乎只有当性格没有棱角，思想失去火花，被“体制化”的人们习惯逆来顺受的时候才可以平安生存,5
这部电影没什么好说的，史上最完美的电影，没有一秒尿尿时间！,5
对不起，我戒酒了。,5
hope is a good thing,5
越狱我感觉就是改编自这个,5
这是我每年都要回顾的一部片子，每当心情低落，人生低谷的时候，或者随便什时候打开，听着摩根弗里曼低沉的声音娓娓道来故事，就会感觉好了很多。好的电影是好的人生陪伴,5
明修栈道，暗渡陈仓,5
若你试自由如生命，你愿意用20年等来一日的逃脱。,5
"Hope is a good thing, and maybe the best thing of all.",4
真的不喜欢，不好看，没感觉,2
不愧是好莱坞大片，一环扣一环，没想到最后不但逃生生天还偷偷把典狱长的贪污转移了出来，证据也送达了出去，帮助了曾经关心过自己的人，情节安排的巧妙，演员演绎的也好，是美国的，有爱国情节的我给打四分,4
看完让人很振奋,5
"在我的心目中,它一直都是最被高估的电影。",3
通过下水道逃出去，这真的是太震撼了，不得不说男主对自由的执念克服了一切，即使待在监狱里，因为不断学习，没和外面的世界脱轨，他才能如此从容面对一切，甚至即使是在监狱这小小世界里自己也是主宰，所以说：学习很重要，学到老活到老。,4
大众经典我从不感冒，为什么？我欣赏水平不行？,2
何为救赎？只有重燃人们心中的希望才能救赎。有希望才有一切可能。即使环境再恶劣，安迪都没有放弃，坚持不懈的写信为大家换来更好的图书馆，帮助有需要的人拿到高中文凭使他们可以在社会上有生存能力，就算知道会惹怒看守也想让人们都听到美妙的歌声，点燃希望之光。有一种鸟儿是永远也关不住的。,5
好片，但是远比这部片更好的还很多，大家整天把这部电影稀奇得不行，其实同年的电影我更喜欢阿甘。,5
太感人的电影！完整看过四遍！安迪从下水道爬出后，在水里在雨中仰天长啸时，就瞬间泪奔！,5
这是一部关于自由、友情、正义的电影!“信念不灭，希望永存”。这其实是他们全体人的救赎，只是选择的方式不同而已。,5
我最喜欢的电影,5
高中第一节心理课。“有一种鸟是关不住的，因为它们的每一片羽毛都闪耀着自由的光辉”，但后来不幸成了我的逆反宣言……哈哈哈。,5
绝对是期待过高导致有点失望,4
非常好，可惜那年有阿甘正传，但我个人认为还是这部最佳。,5
我发现影史顶尖的作品，都反映了人的执念，一种笃定一切的意志力，这种意志不被人理解，但让人佩服，因为大多数人不敢付出这样的代价，他们不敢相信这一切的价值。自由和希望，就是每个人活着的一根弦，绷着就能生，断了就得死。所以“要么忙着去活，要么忙着去死”，在于选择。如果你愿意相信自己会是那只光彩夺目的鸟，那你就不可能被困在牢笼之中，因为安迪的牢笼是他自己打开的。,5
陈凯歌可以靠它吃两辈子饭了，现在看来江郎才尽也情有可原,5
他竟当面一语点破：虞姬是真虞姬，霸王是假霸王。,5
就凭这个，我愿意原谅陈凯歌一切的烂片 你只要伟大过一次就可以了 就凭这个 哥哥你是我心中永远不朽的传奇 你是全世界最大的角儿,5
在野路子出身的张国荣面前，学院出身的张丰毅显得那么单薄,4
"不解,拍出过霸王别姬的人怎能拍出无极来",5
这真的不是电影，而是人生。如此真实深刻地反映了从抗战前夕至文革的那段历史时期下命运凄惨的人们，渗透在每一个细节，包括那个不能忍受戏班虐打的孩子，而文革中六亲不认，人格扭曲更是展现到了极致。当然最赞的是哥哥的表演，如此悲哀可怜的蝶衣让人心痛，不疯魔不成活，人戏不分，现实的他也是如此,5
仨小时的电影，我没上一次厕所，一直专注的在看，除了牛逼我想不出其他的词儿了。直男对于gay来说终究是祸害，他们不敢爱，面对自己的感情畏畏缩缩，伤了别人还假惺惺。每个人都演的很好，蒋雯丽虽然出场不到半小时，也是把角色诠释的淋漓尽致。这真是陈导的巅峰之作了。,5
最优秀的中国电影,5
君王意气尽 贱妾何聊生,5
往事不要再提，人生已多风雨。纵然记忆抹不去，爱与恨都还在心里。真的要断了过去，让明天好好继续，你就不必再苦苦追问他的消息。爱情他是个难题，让人目眩神迷，忘了痛或许可以，忘了你却太不容易。我对你仍有爱意我对自己无能为力。,5
"蝶衣于台上贵妃醉酒，头顶忽撒下无数抗日传单。灯骤灭，台下喧哗。没有人再顾及台上的贵妃。唯有蝶衣，继续着未尽的绝美舞步丝毫未曾停滞。一片混乱之中，也唯有四爷，独自于楼上包厢继续丝毫未曾分神。看到这里感动的一塌糊涂。结尾处“我本是男儿郎,又不是女娇娥”真的落泪了。纯粹坚持的2人去了",5
人戏不分，不疯魔不成活。,5
我記得我標記過這部片子的啊！——我以為這是國產電影的開始，誰知道是結束。,5
你凝视你的脸，几亿人在爱恋。,5
菊仙是个好女人,5
城头变幻大王旗，一个《霸王别姬》，一个《活着》，道尽中国现当代史，百年内无可超越。,5
往事不要再提，人生已多风雨。他是霸王，你是虞姬，“我本是男儿郎，又不是女娇娥”，万丈红尘蹉跌走过半世纪。寥落繁华不由己，十万春花如梦里。剑还给你，命也还给你。“君王意气尽，贱妾何聊生？”陪你唱罢这出、我便离去...,5
"被“历史”绑架了的两个小人物……

《活着》和《霸王别姬》不是中国电影的起点，而是终点……",4
凱歌也曾NB過，那時風華絕代的張國榮也還那麼年輕……,5
不疯魔，不成活,4
那些渴求永远的人，悲都悲得分外妖冶。,5
因为这个电影，从此后对有金鱼出现的影片格外地关注。鱼所代表的意义太多了。流泪在水里的鱼，无性别的鱼，离了水呼吸不了的鱼……,5
一笑万古春，一啼万古愁 2008.12,5
1993年戛纳金棕榈大奖，国际影评人大奖。华语电影唯一一枝金棕榈，陈凯歌同学笑傲多年的资本。确实是华语电影的巅峰之作，以京剧为剧情发展的主线，比《活着》更具艺术性，给人印象也更深刻，特别是张国荣的倾情演出。,5
备课三刷。一边看一边想，如果拿掉张国荣，剩下的东西里，还有几分成色？是不是陈凯歌日后有的一些坏毛病早就埋下种子了？但是，没办法，一个疯子，又遇见了成全他的角色，干柴烈火，谁也挡不住。所有人都被他带的颠三倒四的，这就是角儿，一种迷人的暴力,4
大家只记得程蝶衣，明明菊仙才是更值得品味的角色啊，到最后，一直保留了善良的人只有她一个。生活太难，为了什么而活的内核决定了每个人的命运，再聪明的人都挨不下去，最后剩下的便都是乌合之众,5
耗尽了陈凯歌一生的才华，成就了一个痴情的程蝶衣。,5
重点不是时间的流逝，而是一个理想主义者的死亡。哥哥最好的电影之一，已经不能仅用一个演员来形容他。关注历史背景的戏剧性潜力，关注政治现实对个人生活的影响。,5
翻译成再见我的妾实在是太酷儿了。。,5
"我以为现在已经很难看完一部三小时的电影了，原来并不是，只是现在的电影不值得而已。这样一部快30年前的文艺片，近三个小时全程看下来一点不觉得无聊，不愧为经典。
由于是在B站观看的，观影时可以打开弹幕，感触就更深了，现在的人们一边骂着小四，一边又做着和小四无异的事情。高喊着口号，人均“五十万”，“拜登经费”，“退国籍250”……甚至wen'ge都可以洗了。也不明白他们是怎么做到这么割裂，怎么说服得了自己的。也许这就代表，wen'ge确实做得非常成功。而且他们以为自己拜的是劳动人民？不过是新的袁四爷罢了。
只是感叹，1993年就能诞生这种作品的这片土地，今后再也不会有这样的作品出现，人们不再需要戏曲，也不再需要文艺。听戏的大人们正襟危坐，并不在乎戏曲的故事讲到了哪里，只要最后可以给他们一个舞台唱赞歌就行了。无奈且悲哀。",5
“当他还是一个孩子的时候，他的京剧师傅们对他进行无情的毒打、洗脑，逼迫他承认自己具有女性性格，而实际上他没有。如果他有的话，师傅们也不用毒打他了。所以，由于被迫生活在一个谎言之中，他痛恨所有的谎言，无论是个人的还是政治的。从那一点开始，故事中的所有冲突都起源于他说真话的欲望。”—罗伯特麦基,5
在程蝶衣说出我也揭发，揭发这良辰美景美景奈何天的时候，我哇哇大哭，这部电影最震撼我的不是不疯魔不成活不是唱一辈子戏，而是时代的悲剧洪流下，我们无所幸免的人生，艺术的信仰者被迫成为了艺术的出卖者，在那个悲剧的时代，他连为艺术殉道的自由都没有。,5
哥哥艳不可当,5
在结尾指向性极强的背景乐中主题昭然若揭——是谁毁了戏，是谁毁了中国精妙绝伦的古典文化。同时很讶异这片子没被封禁。,5
这一部，给五星是不够的，但我不敢再看一遍了。,5
今天才看完整这部故事。我本是男儿郎，又不是女娇蛾。电影柔情似水又剑锋直指。若不是太多人关注的是蝶衣与小楼的情感纠缠，恐怕，恐怕也是被禁之物。那黑暗中的最后一剑，又替多少人，了了不敢之愿。,5
"1.前任3、后来的我们，1年见好几部
2.湄公河行动、唐人街探案，1年见一部
3.复仇者联盟、侏罗纪世界，2年见一部
4.我不是药神、摔跤吧爸爸，5年见一部
5.美丽人生、活着，10年见一部
6.泰坦尼克号、大话西游，15年见一部
7.霸王别姬，50年见一部",5
他的十二支船，每一支都是她的名字。她走后，他只得跑遍世界的每一个湖泊和沙漠来思念她，只等她一声召唤便死心塌地的回到她的身边。好莱坞编造一个这么纯粹的故事，让我们看到我们所拥有的感情，是多么的残破不堪。这简直是残忍的，不道德的。,4
羡慕珍妮，不管她多么叛逆、落魄、堕落，永远有阿甘在等她回来,5
妈妈说，生活就像一盒巧克力……请不要再续下一句，耳朵听的起了茧子。,5
傻人有傻福，实际上并不是这样的。在我看来，阿甘的妈妈才是最伟大的人。很多普通人把低智商的孩子早早就放弃了，不让上学，不与别人接触，也许是为了保护自己的孩子，但是这样以后孩子就等于废了……,5
每年看一遍，每年哭一遍，看看自己幸福还是阿甘幸福！时间：从2003开始每年一遍,5
重新再看一遍，觉得奥斯卡当年颁给《阿甘正传》而不是《肖申克的救赎》，还是对的……更广阔，经得起各种解读，每个人都能找到自己的点。,5
Mama always said life was like a box of chocolates. You never know what you're gonna get.,5
阿甘奔跑的意象，应该留在了很多人心里。,5
太甜美的美國夢,4
《阿甘正传》总觉得有点伪心灵鸡汤的感觉。阿甘人生处处开挂有点不真实，相比较来说更喜欢《肖申克的救赎》。,4
you are my girl.,5
"这是一部美国典型的反智题材电影。聪明的人未必一定能成功。阿甘的智商极低，却情商极高。他一直怀着单纯的心，做了在别人眼里了不起的事，也尽力照顾身边的人。
成功充满必然与偶然。
人生就像是一盒巧克力。
最经典的两句台词",5
这部电影的主题是：“保守主义始终代表美国先进生产力的发展要求，始终代表美国先进文化的前进方向，始终代表美国最广大人民的根本利益。”,5
我生命里最温暖的一部电影,5
"十年前看过一遍，那时还是一个小屁孩，就像Forrest的妈妈说的一样，生活就像一盒巧克力，十年前的我绝对不会预料得到现在我会成为一个这样的大男生。Forrest Gump真是把""蠢萌""这两个字发挥到极致，我的意思是，蠢萌，其实也是上帝给予的天赋。",5
人生就像一盒巧克力，你不知道会选中哪一颗。,5
又是七年后，重温一遍。上帝是仁慈的，妈妈走了，珍妮走了，朋友走了，可是给阿甘留下了一个孩子。要是没有孩子他该怎么活下去。也是电影的仁慈。,5
遇见阿甘一般的男人是一生的梦想,5
"上中学时看的剧，印象最深的是那句：""Run! Forrest! Run!"" 然后，他就跑出了自己的阴霾，跑出了崭新的人生~非常励志的一部剧，让我重新审视自己，让我更有勇气！",5
电影以一个虚构的人物阿甘为主线巧妙的融入了越南战争，水门事件，总统被刺，乒乓外交等多项历史事件，以一个小人物的视角看待历史问题，故事采用阿甘对白的方式讲述故事。电影展现了阿甘的乐观坚强，以及感染了周围人，相对来说还算励志。,4
我一直记得那根羽毛,5
这当然是部励志电影，但我也觉得是部教育电影。阿甘智商底下，思想单纯，所以他的成长环境很重要，需要三观正的人来引导他，显然他是幸运的，他娘和他女朋友在他成长过程中给予他足够的爱，鼓励他，支持他，让他辨别善与恶，才成就了他，给他娘和女朋友三颗星，值得我学习,5
life was like a box o'chocolates. You never know what you gonna get ！,5
真他妈的经典啊！！！,5
一切尽在不言……我人生的第一部电影,5
这部电影很棒，居然还有很多人说看不懂，说看不懂的人说明你的经历太少。阿甘只是忠诚善意地对待身边的每一个人，他也只是专心专注努力的做好每一件事情，所以他才能成功，活好当下是这电影要传达的信息。,4
看完有些伤感，为什么相爱却不能相守，阿甘在别人眼里很成功，但那到底是不是他想要的,4
人生就像各种各样的朱古力，你永远不会知道那一块属于你。总体来看整个电影的情节非常好！连贯！演技也好！故事给人的印象非常深刻！,4
可我还是觉得他很孤独。跑得太快的时候没人跟上他，停下来的时候身边的人一个一个都离他而去。,5
好电影：平庸——神奇——惊叹——返璞归真。,5
这是我永远也达不到的人生。我不够坚定 也不够坚持。,5
众所不周知，这并不是我认为的“励志片”。阿甘只是美国过去时代里“人”的反面典型，他的偏差因为稀缺，拿到了大学文凭，稀里糊涂参了军，参合了别人的开船捕虾梦，救了人，见过几任总统。他不知道规则，他不怕死。他爱吃冰激淋，他爱吃巧克力。他是跑步、打乒乓的天才。他有一个不视他为另类的妈妈，还有一个一度若即若离的亲梅竹马。谁能想到1994年，美国的电影制作已经这么精巧，令人不可思议。无数个笑点儿之后，那个曾经抓不住的女孩儿还是走向了他，死在了妈妈的床上，埋在了小时候一起玩耍的大树下。Jenny，她再也无需飘零。所以，这根本不是励志片，就像真正的跑步并没有具体的意义一样，它就是我们穷尽一生的未知旅程，起于开始，终于结束，恍如风中的羽毛。,5
从个人成长史透析美国政治社会史，从人性深处的角度还原一个最纯粹善良的爱，和最坚定而简单理想。在阿甘身上能够去审视我们所谓“正常人”的种种弱点：怨天尤人、虚荣、贪婪和自私。它是一座简单却又深刻的催泪反应堆，无不令观者动容。每次看都无法抑制内心强烈的感动。,5
高中英语课放了一次，大学思修课放了一次，还让我们写观后感，无语。。。老师咋都在放这种电影呢,4
智力75足够过好这一生，just run run run。不要再左右摇摆，去相信朴素的人生智慧，然后执行执行执行。,5
痴人果然说梦。受不了这样的世界观。,1
想起是在某人的电脑上面看的就恶心  而且他还不愿意发给我,4
只要最后那个人是你，等待就是值得的。,5
经典励志电影。母亲真的很伟大。,5
"“我甚至连一张他的画像都没有，但他永远活在我心中。” 要敢说，这是我一直深爱的电影。

3D效果言过其实；被删裸戏无察觉；IMAX看清冰山全貌；Rose美的神魂颠倒，Jack帅的令人窒息；甲板上Jack对Rose说:I see you. 看过不下10遍，能记住每个情节、台词、人物及配乐，该哭地方还是会哭；3碟正版VCD能记住两次换碟的准确时刻；初二看完后自己经常在水盆里用水瓢演习沉船全过程…",5
爱你原本只是一瞬，却不知在时间的洪流中成了永恒。,4
那对对死无所畏惧的老夫妇，那个不为外界干扰的乐队，那个为生而做一次假父亲的男人，那个为爱人吹响口哨的女人。都是为了一种心灵上的执着。,5
将永远是我在电影院所看过次数最多、最感动、也是最好的电影,5
学校组织放映的影片，大家好像对rose和jack恋爱过程猎奇，但是让我感动的一幕是轮船将要沉沦，海上乐队的绅士们整理领结，肃穆庄严的弹奏最后一曲，那一瞬间，仿佛听见一首镇魂曲在响彻。,5
"生死两茫茫
不思量
自难忘",5
剧本居然收入人民教育出版社教材，可想而知对我国的巨大影响力。,3
當船體即將一裂為二的前夕，全船的電燈極其巧合似的停滯了，如失血前的暈眩、如窒息前的睜瞳，讓人驚覺這艘船原來是活著的──全片194分鐘，唯獨這幾秒，鐵達尼號才真正顯現出它原該是主人公的存在之感，而非羅密歐茱麗葉情話綿綿的打卡佈景而矣。,3
我学会了吐口水，我努力的活下来了，我去了好多你说过的地方，我学会了双腿张开骑马，我生了好多孩子，我已经活到一百岁了，我可以见到你了吗？,5
有些片子，必须得等经历过再去看。没有为爱情放弃过什么的人，不会在露丝从救生船上跳回大船的那一刻落泪。,5
一部应该被记住的电影.,5
事隔那麼多年依然無法忘記當初的感動。,5
我想失去的才是永恒的。,5
还用说么？太经典了。,5
Rose可以为爱而死，最后在Jack的舍命相救及恳求下，选择了为爱而活，而被留下的那个人是痛苦的。到老奶奶的Rose站在船边上，把海洋之星扔回海中时，我想那是它最好的归宿了。灾难面前，有的人把生存的机会留给了别人，而有的人花钱占用了别人的机会。,5
第一次看到沉船，第一次看到正面全裸，第一次看到伟大的爱情，第一次...,5
打动人心灵的情感灾难片。除了男女主之间的互动，印象深刻的还有在船沉前三等舱躺在床上安详拥抱的两位老人，母亲在海水即将淹没时，拍打两个孩子入眠的场景，船上一直奏响的音乐，灾难来临时，从容赴死的船长和设计师，都让我流泪满面。,5
如此平庸的一部片却缔造了一个票房神话。,3
找不出瑕疵的神片，每一个细节都极尽完美，卡梅隆无可抑制的才华，搭配詹姆斯霍纳天籁般的原创配乐，不仅是Jack和Rose的爱情，死亡时刻乐团的演奏、船长与船共存亡的坚定、一对老夫妇相拥而眠、母亲为孩子讲睡前故事，都染上了一层浪漫潇洒的色彩。我一直认为，本片真正感人的部分，爱情只占了一半，生死间的抉择差异、烈狱环境下人性的考验是另一半，但当最后Rose将海洋之心抛向海底，Celine Dion的声音响起的时候，泪水终于无法忍耐，一切的缘由都失去了意义。,5
"""Every night in my dream, I see you, I feel you.""",5
能与诸位一起演奏 是我的荣幸,5
我所知道的爱情就是无论付出什么代价都要让你有幸福的人生， 尽管那人生我无法参与，那幸福不是我来给予。,5
"第一次哭：rose在救生艇上仰望，jack留在大船上，眼中闪着泪光却微笑着看过来。太美好了。当时魂穿rose感觉，如果我不跳回去，这个画面，就是我心中最美好的男孩子，留在我心中的最后一面。这一幕一定会成为我夜夜的梦魇，让我在悔恨中哭着醒过来。
第二次哭：rose为了彼此的诺言，争取搜救好好活下去，哭完后最终扒掉了已死的Jack在救生木板上冷僵的手，Jack慢慢坠落，带着宁静的面庞永眠海底。
第三次哭：Rose Dawson你我永不分离，我带着我们相爱的记忆，好好活下去，我之后的生命与幸福由你共享一半
第四次哭：结尾白发苍苍的老奶奶梦回泰坦尼克号，青春少女穿着洁白如婚纱的裙子，穿过金碧璀璨的梦幻廊厅，推开门后喜欢的人们都活着，笑着夹道祝福，楼梯的最高处，Jack回首，微笑，还是初见的少年模样。",5
当老年的Rose午夜梦回，一个长镜头穿过大堂，摇上楼梯，站在钟表前的Jack转过身来，意气风发，潇洒倜傥，宛如昨日。,4
1998年，哈尔滨火车站地下给初恋女友买的盗版光盘。,4
"让我们期冀着：原来世界上真的有人无端端地比热爱生命还要热爱另一个人。

二刷。我心目中最好的爱情电影。我做过最伟大的事情就是为我最爱的人延续生命，两次。",5
