Review,Rating
如果你觉得只要电影里有人得白血病那么这部电影就是烂片的话，你不就不要看这部片了。,5
全放映室的大叔大哥都在抹眼泪，更别说女生了，这电影点了香港人的泪穴,4
并未洗净铅华，却用最自然的从容令人动容,4
隔了很久我才看了岁月神偷。岁月神偷是好，但还是不及天水围的日与月。岁月神偷毕竟刻意雕琢的痕迹太重，而天水围的日与月，真正做到了润物细无声一般的冲淡与自然，却更蕴含无声的张力。但是作为两部都很杰出的香港电影，岁月神偷又更担负着一层港片复兴的使命意义。,4
在柏林有连绵的掌声，但这个故事模式却是做作多过感人.典型的港片励志怀旧手法，突兀且无趣的悲剧转换模式（如果不用某癌，而让哥哥只是因弃恋断肢而后沉沦自杀会不会好些），人生“一半难一半佳”以及“最重要是保住个顶”都过于说教.看在小弟本色演出、本色偷盗以及鱼缸头罩宇航员等等加至四星.,4
它讲述了一个前途光明的年轻人死于绝症的故事……煽情处是编剧精准计算的，但小孩子的演绎天然发挥让煽情真实好多。黄金一样的色调和过去情怀，其实不需要死亡也可以表现出岁月流逝的伤感和来日可追的信心。,5
这似乎是导演真实的经历，也可以算“港人的心灵史”（如果《唐山大地震》也敢自称中国人心灵史的话），那个孩子把英国国旗丢进水里时，是否也暗谕了一种对过去时光的告别。,4
哭死我算了。,5
看過才感受到美國版跟日本版的極大區別，除去整個情緒上的控制度，看過日本版才能理解為什麼阿八會用牠的餘生去等待主人，因為教授實在太愛牠了啊！教授對牠的那種愛和呵護是美國版完全沒有表現出來的，如果先看美國版會認為這是一隻神犬，跟主人之間的情感是冥冥中的，但日本版告訴我愛絕對是相互的。,5
我等你是因为，再没有人像你对我那么好T T,5
喜欢教授那句话：人有人格，狗也有“狗格”。日本动物爱护管理中心主页上写着：1.无法继续豢养的动物，请不要丢弃（以前是免费，现在只需交付2000日元即可由保护中心收容接管）。2. 遗弃、虐待动物是犯罪。3. 遗弃动物者，处以50万日元以下罚款。4. 杀、伤动物者，处以一年以下刑拘或100万元以下罚款。,5
"八公的""原味""还是在日版，教授去世后与之相关的人们对八公的薄凉，在它始一而终的热诚面前抬不起眼。
片尾的长镜头中，始终无人关照这位""人类的朋友""的死亡。似乎是一种讽刺，人弃忠友而去，却等待它们用生命为人类守灵。
除了教授，没人担得起这份守候。",5
美版的才是忠诚，日版的看到是凄惨和无奈，无家可归，忍饥受冻，被人遗弃，追打，如果给他一个家，像教授一样爱它，它也不会这么凄惨，只能在车站那苦苦的等待那个唯一爱它的人。,4
这真不是一个温情感人的宠物故事。如果说美版电影是在歌颂狗的忠诚，这个“被嫌弃的小八的一生”的日本原版则是在控诉，一个多么冷漠的社会才会发生这样的故事啊。作为日本著名的左派导演和本片的编剧，新藤兼人的剧本不简单，一巴掌一巴掌地打在那些表面上温良恭俭实际上内心虚伪的日本人的脸上。最后一个长长的镜头，昭和十年的涩谷车站，八公终于在雪中死去，但过往的行人无人理会，一队日本兵列队走过平静的东京街头，代表爱与诚的八公死去，一个全民癫狂的血腥年代即将开始。,4
美版突出悲伤氛围的塑造，日版则显得更加真实。除了八公与主人外，日版更多地刻画了八公与其他一些人之间的种种。相比美版里大家都爱的八公，日版里的八公则是忠诚过头而遭到其他人厌烦像踢皮球一般推搡的对象，也因此更加真实感人。,5
一只狗对其生命最初的爱，又想起那句话“我们之所以痛苦是因为我们曾经幸福过”,4
反复叮嘱家人：狗狗也有狗狗的权力，要保护狗狗权力的教授，台风天担心阿八着凉所以淋雨把阿八抱进屋取暖的教授。给阿八抓虱子还要整齐排列的强迫症教授。和阿八一起洗澡的教授，看到阿八在车站接自己，满足骄傲的教授。想到这么温柔的人一会儿就要死了，我的眼泪根本止不住。阿八啊，你久等了。,5
我小时候家里养了一只纯种土狗，天天陪我爬山抓鱼刨沙坑。它死的时候我妈说我哭了一星期，打那以后，她发誓不再养狗。,5
因为也喜欢小狗狗，所以这部电影让我很感动，爱与责任，一旦选择，终身负责,5
哭死我也,5
比美版好，没有硬煽情，本以为会泪流成河但实际上情感很克制。讲述八公的悲剧之余，将生活的横切面静静地呈现。人世百态，人情冷暖，四季物哀，八公穿梭其中，倚靠关于教授的美好回忆，熬过了不断被遗弃和损害的一生，最终成为风雪中的一座丰碑。八公承载的是人们对教授的回忆，更承载了忠诚、善良与慈悲这些稀缺品质。影片表面温情，实际上编剧歌颂一群人，又讽刺了一群人，立场清清楚楚。P.S.字幕出现时才知道编剧竟然是新藤兼人大神。,5
原版真是比美国版好太多，更催泪和有寓意。女儿的自私和离开，让はち的陪伴与守候更让人唏嘘。教授对はち的感情也更细腻温暖。后来被人抛弃，更见证了人类的自私与冷漠。明明是抛弃，让はち去流浪，却将其美化成自由。默默的等候被调侃为傻和脏东西，被人扔石子，被人嫌弃，被其他流浪狗咬伤。最后はち落魄瘦弱的样子才是现实生活中会有的模样吧。你说，为什么要等一个永远不会回来的人呢？因为这个世界上只有你是爱我的了。。。,5
美版主要表现狗之忠，日本原版主要表现人之善。前者欢快之中显煽情，后者温情之中酝感动。,5
相比美版，原版故事置身于特殊时期和环境（大多数人都在求生存），小八的忠诚更为真实，严肃的日本教授遇上萌八的感情更为动人，躺在床上看完哭得我快窒息...好几次做起来缓气..,5
相比广为人知的美版而言，日版确实低调了一点。但是我却意外的最喜欢这一版的演绎，因为没有那些刻意的煽情，以及为了迎合观众而编排的桥段。反而是通过人与狗之间的故事，曝露出秩序井然的社会人情世薄的真相。人有权利，狗同样有权利，教授始终将阿八当成一个孩子看待，他们之间的情谊便超越了人与宠物的层次。这就是阿八十年如一日守候令人感动的原因，那些在人身上丧失已久的情感，却始终由狗狗来守护，与冰冷的人际关系比起来，阿八倒是活得更像一个纯粹的人。,5
因為Hachi，火車站已不再只是火車站,5
狗狗是人类最好的朋友，一定要对他们好哦！,5
秋田犬是大大的萌物啊，跟猫相处也颇善。,5
“为什么要等一个永远不会来的人了？” 比美版更平实、简单，没有煽情和太戏剧化的情节，但美版先入为主，还是更喜欢美版。,4
在看过美国版之后，来看这个版本，我更喜欢幽默中带有伤感的美国版。虽然脱胎于此，却“青出于蓝而胜于蓝”，所以，美国版5星，日本版4星了。,4
阿八，为何要等一个永不回来的人呢？？,4
美国版的更偏童话一点，日版更贴近事实,4
教授去世之后阿八的凄凉处境可见世情人情，千鹤子正如佣人所言是个冷酷的人，她对养狗的欢欣不过一时，而教授对阿八的真心相待却换来阿八一世的牵挂。为什么要等一个永远不回来的人，因为那是它的牵挂，希望阿八和教授天堂再续温暖。,4
新藤兼人的劇本裏面應該是有著好幾個不俗的切入點，本可以把這個爛俗的故事導向更深層面。片尾曲坑死爹了...,3
這個故事早就熟悉，美國版的改編顯然更勝一籌。看完驚訝的是1925年的日本人對一隻狗的文明程度竟然達到了那個地步，可也短短12年後，也就是1937年，這群文明人竟然干出了那麼反人類的事情。通過一隻狗也能令我們回顧日本那個時代，1925年，知識份子地位很高，人人和諧，商鋪林立，似乎經濟不錯。這時候軍國主義迫切需要一個忠誠的故事，狗的忠誠感動了報社，於是變成了宣傳對象，到了1931年，發動918的時候，顧客喊出人道主義毀滅那條狗的時候，日本社會已經變成了仇恨社會，狗被人扔石頭拋棄，得不到喜歡，跟25年的和諧社會比起來，31年的日本已經走上了邪惡。直到1935年，狗去世，諾大的火車站，甚至路邊的行人，人跡罕至，可以看出日本的經濟相較於1925年，已經進入了一片寒冬，而這時候，离日本全面侵華只剩下2年,4
最终，八公带着对主人的眷念死在了冰天雪地里。之所以要等一个永远回不来的人，是因为这个世上啊，除了你再也没有人对我这么好了。,4
我妈从未养过除了我爸 我 三条鱼之外的任何活物，但是我有个习惯，看到动物题材的任何东西，泪腺都会特别发达，甚至是角马迁徙纪录片，我记得看完八公心里唯一的感觉就是我会有自己的狗跟喵的，动物跟人之间的感情，纯粹简单，你养我，我忠你，不离不弃,4
先是看了美版的，迟迟未看日本老版，这次终于得见，比美版更稳，没有走煽情路线，故事在那里静静呈现就很动人，更有东方的人生况味，八公和主人终会在樱花盛开的另一个世界相见，生与死不是距离，人和狗更不是。,4
"完完全全的一部悲情片，故事的走向非常的悲剧，每一个照顾小八的人，各自也都是悲剧人物。

教授猝死，小八失去最爱它的主人。

教授的妻子卖了房子，先是和女儿同住，然后回老家和母亲生活，小八被迫送往各处。

教授的好朋友和妻子收留了小八，却也猝死，他妻子也无力抚养小八，小八变成流浪狗。

买串烧的主人一直喂养和关心小八，却和客人发起争执，拳脚相向，小八无处容身，被流浪狗欺负，最后饥寒交迫，悲惨的死在寒冷的雪夜。

影片中教授死后，基本就没有一个温情的场景，一切都表现了生活的无奈，就如《萤火虫之墓》中的兄妹，一步一步的，悲惨的走向死亡，似乎已经是注定的结局。

小八慢慢的老了，它应该很想休息了。结束前的一幕，是它先去了老宅，被新主人赶走，又去了曾经抚养过它的地方，里面传出的婴儿哭声，小八默默的离开",5
看这部电影，哭得稀里哗啦。我当时只是很爱狗，没有养宠物，养了以后更是不敢看了，我喜欢把电影反复看，唯独这部，只看过一遍，然而观看时的情绪，一直深深记得。,4
美版的完全就是催泪弹，日版的看到的更多的则是凄凉和无奈，一声叹息。,4
对他温柔一点吧,3
无论看多少次，多会哭流满面。,4
豆瓣上几种片的分数Inflation的厉害。类型片的话动物/儿童/纯爱，国别的话日本/泰国/法国，分数都要打八折,2
八公故事之所以感人的另一面，其实是所有相关人士极度的冷漠呀。导演的优点是各处都点到为止，以致于看下来似乎全无主张，然而所有推动力在剧本中已经提供了，这是很骨鲠的选择。八千草薰老了还挺可爱，但这个角色并不讨喜,3
"“为什么要等一个永远不会来的人了？”
“养狗三日，便会对你终其一生。”
又一次把眼泪献给了小八，相比美版而言，日本更加注重揭露人性，现实之残酷，给人一种凄凉的感觉，尽管已经知道了结局，但教授死后，眼泪依然止不住流下，整部影片的泪点终于在教授的妻子来看小八时爆发，最后，小八死在冰冷夜晚，影片就这样结束，一直希望能够有人注意到这一切，出现在小八身旁……影片结束，留下的是无限的感慨和思考。
珍重啊，小八！",5
美国电影和日本电影的区别展露无遗。我个人还是更喜欢李察吉尔的美版。几乎从头哭到尾。而日版的，觉得教授和阿八前面感情着力还不够，中间太多拖沓的场景，以及，我实在无法理解冷漠的千鹤子。所以还是更喜欢美版。,3
现在看表现侵华时代的日本家庭电影，心里老有种很排斥的感觉。看到那些所谓的温情呀，感动呀，或者悲伤，都透着一种虚情假意和矫揉造作的尴尬。,3
水准接近是枝裕和最好的“步履不停”。几乎所有导演在拍摄底层家庭题材时都会有意无意的使用自上而下的镜头，只有是枝裕和永远能够保持温暖的平视。电影含蓄的再定义了家庭和亲情：在商店倒闭前，里面的东西都是无主之物；在这个小小家庭分崩离析前，他们就是有爱的一家人......,4
状态回勇，几乎可比肩盛年辉煌，亦可窥见其往日作品所有标识性的元素，貌似是相似主题的变奏，实则是螺旋上升式的复调，兼有早中期对社会现状的敏锐洞察与近年来着力建构的家庭谱系。延续《如父如子》探讨「血缘」问题，一群底层蝼蚁的相互取暖，合力奏出困厄中的强音，并回归至《无人知晓》的直面黑暗，撕碎温情面纱，直抵最残酷的核心——无论血亲与否，「家庭」的式微与毁朽、个体的成长与群体的分崩势在必然，早晚死亡会赶上我们，孤独会让我们分离，从家庭小格局升华到悲悯的高屋建瓴。群戏太棒，数度泪目，此刻我们拥抱得那么紧，但终有一天会如《奇迹》般汇合又错开轨迹。最感动：1、安藤樱所有戏份，尤其是抱着玲玲烧旧物段落；2、池松壮亮的短暂出场；3、海边集体跃起；4、暗含四季时序，充满生活质感，沉静如海。,5
整部电影里，最令我感动的一幕是大家坐在屋外看烟花的场景。一家老少坐在院子前，听见烟花声响起，一起抬头看着远方的天空，没有人说话，也没有烟花的画面，特写里只有每一位家庭成员对未来充满期待的脸。这个看似美好的画面，令人唏嘘不已。这样的美好，和烟花一样转瞬即逝。,5
哇哇大哭。不能选择的是血缘，可以选择的是亲情啊,5
看完一部好电影我也想写点什么，但我就是写的没别人好。我只需要记得，今天看完它，我又哭得不行，最后我已经很克制了。在电影最后一个镜头时，我不由自主说出“真的看不下去了。”一直希望片子里的人好好的，但又无法不喜欢这样的“坏”电影。有爱的活着，多好啊。,5
不管他获了什么奖，都欣赏不了。片子平淡的好像个家庭录影带，几乎完全没什么主题和故事。真的是冲豆瓣评分去看的，但。。看完说不清什么感觉，无法总结，没音乐，也不煽情。。。如果平淡，但好歹有个余味吧，也没有。。结束的也莫名其妙,2
整部电影叙事的时间跨度大概有一年，从头一年的寒冬腊月到第二年冬天。两个小时的片长，核心事件不是很多，但是信息量特别大，某个角色脱口而出的一句话或者镜头一扫而过的一个画面都会让观众仔细思索一番。加之每一个角色都很立体，心理活动都很丰富，所以它特别值得二刷。,5
感觉是枝裕和的电影还是更适合一个人在家默默观看,4
这是是枝裕和最擅长的社会视角，诙谐平静中蕴藏绵长的视觉之火，余味中熊熊燃起，照亮影片中的每个细节，照进人心最幽微处的璀璨星光，照出太平盛世里冷酷社会暗疾。久久不能平静，复杂与童真并行，美丽与丑陋共生。这是真的“看见”，是电影眼的最迷人时刻。,5
和《无人知晓》对比的话，是枝裕和结构和剧作上控制力衰落还是很明显的。但对类似主题复调式回归中，一个作者内在生命经验在时间中流淌所带来的文本上变化和感触，他对社会和人性经年耐心的观察、等待和摸索，恰恰承托出，与是枝裕和差不多同一时间出道的贾樟柯，还在《江湖儿女》中用符号宇宙空洞地重复自己二十年前生活经验。,4
在青岛红树林酒店影院观看，观众还不少。演员精彩，剧作实在，使前半部平实的生存描写也让人看得津津有味，后面内情揭示也就分外引人。许久没看过国语配音版电影了，虽损失了原声魅力，但更多的精力注视着演员的细腻眼神，动作，似乎获得的东西比分神字幕多不少。真是什么事情都可能是有利有弊啊。,4
出生地未必是故土，心安处才是；有血缘未必是亲人，有爱才是。愿世界温柔善待每一个没钱的人、缺爱的人、以及没钱又缺爱的人。,4
看过是枝裕和导演所有的电影，算是一起成长比较熟悉的一位导演，一路看下来，会发现他在创作上的不断思考和尝试。从《步履不停》找到了自己的风格之后，他一路把家庭题材的片子拍成了鸡汤，然后就跳出创作的舒适区，拍了一部《第三度嫌疑人》，但风格上已经非常的成熟，早就有大师风范。到了这部《小偷家族》，既是他在舒适区内的创作，同时他也延续了上一部的尝试，加入了社会问题，在剧作的处理上延续了半开放，故事最后也没有真相，没有明确的答案，只是把值得思考的问题呈现出来，留给观众。导演这些年擅长并思考的东西都放在这部电影里，就像一个阶段性的完美总结汇报，非常让人好奇他下一部的法国片会做什么尝试。这周的几部新片看下来，一对比，感觉在院线片的范围里，必须怒荐！这样的电影再不进电影院，你还等什么呢？,4
从头哭到尾。这才是电影存在的意义啊。也只有这样的电影，看完后，会捡回一点点对人类的敬佩啊。安吉拉.卡特说：“我多次注意到人类有种特性：如果没有家庭，他们会自己发明一个。” 是枝裕和打破了基于血缘的、家庭主义的主流烂俗叙事，让几名畸零人来展示爱与弥合的力量，何其珍贵，又何其高贵。,5
"所谓的“是枝裕和电影宇宙”就此形成。从表层出发，这是一部《无人知晓2》，底层群像在各方驱动后“家庭重组”。但我们常习惯于用“血缘”来概括是枝裕和一系列作品主题，却会忘掉他本质上不是在讨论这些字眼，而是字眼背后——个体与个体、个体与社会的双向关系。情感是如何在阴霾里透出光亮，如何在角落里无声传递。
另外这次能回到巅峰水平，和表演个个精彩是分不开的，从《无人知晓》后是枝电影的力量，基本靠“表演＋细节”来带出生活经验持续累积共鸣。这也是为什么最后安藤樱、中川雅也和两个小孩的落幕戏，都堪称是深水炸弹连炸的重磅效果。",5
最重要的是那个冷静的是枝裕和又回来了，当然依然包裹在爱意里。,5
偷蒙拐骗寡廉鲜耻的一群人凑在一起嚼橘子皮的甜味，听烟花盛开的响声，堆丑陋的雪人。远离血缘和制度，新的家庭，不光彩，却有无杂质的温暖。,4
能在电影院看《小偷家族》是幸福的。,5
安藤樱成就了这个电影，给是枝裕和注入了不一样的东西。,5
是枝裕和精准地解构了这个家庭，在真相揭露后所有的温情和美好瞬间分崩离析，却又瞬间升华成了超越亲情的至亲至爱。盘问抛出的问答句句质问家庭和亲情的定义，锐利如刀。比［无人知晓］和［如父如子］更加社会性，更有反思的力量。,4
即便今年的动画电影整体水平偏低，也不至于把这样一部作品推上神坛。,4
正太把御姐，罗莉泡猛男——这真是一个三观尽毁的电玩世界！,4
最美告白：你脸上的像素好高啊！,4
"迪士尼的华丽逆袭！
当拉尔夫落向可乐山，耳边响起坏蛋宣言的时候，即使我已经猜到了结局依然被感动到一塌糊涂……",5
给我一瓶可乐 + 一包曼妥思 我能拯救全世界！！！！,5
必须今年看过最好看的动画片！在电影院听到我大村姑团的歌曲实在太威武了！,5
蜀黍和萝莉、御姐和正太的逆天组合，和《复联》《林中小屋》一样，以“穿越”串起主轴，却没有前者的一锅乱炖，而是毫无违和感。以“反英雄”主角的消极情绪，一路升温来找回正能量。倘若你曾是8位机或游戏厅的玩家，必定能够旧梦重温、重拾童趣！,4
给这片子差评的多半曾是班干部，他们去游戏厅也都是领着老师去逮人的。所以，我认为打低分者才是真的无敌破坏王。,5
"不出意外这应该是今年最好看的动画片了！片子里面一""下""一""上""两场戏都超级感人，小催泪。""Hey, look at the high definition of your face!"" lol",5
昨晚是第一天首映，一直激动到现在，绝对可以称之是迪士尼的崛起之作，近年来最有创意的故事最用心的设计最可以证明迪士尼实力的影片，brave，tangled几乎没有可比性 go watch it!,5
不容错过！每一个镜头都充满了惊喜~！每一句话都充满笑料，结局也带来很多感动。影片里出现了很多经典游戏人物，有美式的，也有日式的，身边的老美一个个看的惊呼声不断~~！,5
如果说人设制作配乐什么的是动画的血肉，那创意和情感就是动画的魂。而为什么当初说《勇敢传说》让人失望，因为它虽然将前者做到无可挑剔，但它的后者却弱到爆。《无敌破坏王》游戏机内世界的设定之巧堪比当时的《怪物公司》，而对于主角心理的描摹也令人叫好，小机灵更是遍布全篇。最后我有泪啦。,4
这难道不是Pixar出品的吗？,5
非常过瘾。大反派破坏王为赢得尊重跑到另一个游戏里冒险，各种奇遇和阴谋危险。。。故事紧凑精彩，画面非常绚丽漂亮。游戏背后的世界勾起我们的童年回忆，充满对老游戏的致敬，有点初次看《怪物公司》的感觉。情怀深度故事画面样样不差，个人目前的年度最佳动画，颇有奥斯卡相！,4
蛮赞的哦！当然还是有故事上的不足，但会因为突然地搞笑部分而不会太在意故事。特别喜欢这个‘世界’的处理。比我想象中的好多了。适合80后90后？连我这个不是玩很多游戏的基本上都懂啦所以也无所谓。看完后……牙齿有点疼就是了，不喜欢过分甜和可爱东西的人不一定适宜~,5
如别人说的，确实有点皮克斯乱入迪士尼的意思。靠回忆赚分数的电影。像素游戏、街机回忆，尤其是“上上下下左右左右BA”这种，让我这种长泡游戏厅的人实在无法防御。故事简单有趣还带些温馨感动。角色也可爱，特别是那个小女孩，又萌又坏，萨拉·丝沃曼的配音也棒。今年在影院看过的最喜欢的一部动画。,4
三观正确，技法娴熟，娱乐性强，还有什么苛求的呢？,4
如果一直在英雄使命里面展开的话估计就是满分了,4
OMG 在学校看的试映 一定要正式上映的时候再去看一次！！！ 从头到尾满满的都是彩蛋啊啊啊！！！  看到那么多游戏人物都聚在一起就觉得好有爱！！！ 啊各种好有爱！！！ 有机会一定列个Reference的列表出来 UUDDLRLRBA,5
两个最不受待见的人相依为命，共同成长，最终发现了自己的价值。天生我材必有用，每个人都值得拥有一枚奖牌，无论你是破坏王还是阿修。,5
突破的迪士尼，有回忆却无情怀，有佳句无佳章，设定、创意不错，但讲述方式一路下滑。开篇惊喜以为会是游戏世界的《超人特工队》/《超级大坏蛋》+《怪兽电力公司》，没想看完感觉是动画版的《极速赛车手》…无个性，满满都是其他动画片的影子。 “如果那个孩子喜欢我，我还能坏到哪里去呢？”,3
特意大半夜的跑去看了原声场，还真以为是今年的神作呢，整个就一个调色板毫无节制的追逐游戏，追逐越来越快真让人担心动画师的调色板会在高潮时刻跟着失控。也许大家看的是自己的怀旧情结？这样的反英雄故事没有亮点只能算不功不过，连桥段还都是大把眼熟的拿来主义，天朝的观众都返老还童了？★★★,3
在美国看的第一场电影。广告长达半小时，2d播完播3d，以后谁说国内影院广告时间长跟谁急！,4
又是一个老套的故事……三星半，音乐和效果还行，视效本来可以更好的,3
极其俗套的故事套在一个生硬刻意的充满Bug的设定里，笑点萌点也不足，真的还是很＂迪士尼＂,3
sugar rush毁了这片子，但这就是迪士尼的品味,3
还是非常迪士尼，非常6到10岁！看一个无趣聒噪的小女孩在粉红色糖果世界里玩赛车，r u kidding me?!,2
