Review,Rating
大脑觉得你死了，要身体有何用。意识觉得你死了，要自由有何用。失去了味觉，再多汁的牛排如同嚼蜡。失去了痛觉，再完美的母体都是坟墓。人类是让星球有意义的救世主，还是侵占土地的瘟疫。人工智能是豢养人类的病毒，还是构造乌托邦的上帝。如果可以，是该在红色药丸里苏醒，还是仍在蓝色药丸里沉睡？,3
"22年后才看，依然觉得很震撼！非常硬核的科幻加上禅意东方哲学，重点是同时拍得十分浪漫。以今天的眼光来看，电影里的世界观、理念甚至是服装依然很超前，十分喜欢Neo和Oracle的对话，整个故事的核心是Know yourself, 别人告诉你什么不重要，要你自己打从心底相信才能创造奇迹。每个人都得坚信点什么，才能做出颠覆性的改变。There is a difference between knowing the path and walking the path. 无论是选择红色药丸还是蓝色药丸，都是人性，可能大多数人都会选择在虚拟世界自欺欺人，舒舒服服毫无意识地过一生，但就是那么珍贵的一少部分人，宁愿不被控制不被欺骗，选择生活在冰冷的现实，终其一生不断抗争。Wachoiski真的太牛逼了",5
99年的人一定觉得世界会变得更好，所以还愿意求真和打破。搁现在，‘’请让我吃蓝色药丸，躺平赖活。‘’,5
Matrix的母体概念比盗梦牛逼啊，只不过变性兄弟在庞大的逻辑面前没有诺兰熟练的驾驭能力唉。,4
故事开始叙事不清，各种意淫；里面武打不伦不类，全部是绿色基调，感觉很不上档次，大部分演员演技实在拙劣~·~,2
对科幻片的最高褒奖应该就是22年后在看依然想说一句牛逼!,5
"哲学, 神学和无神论. 印度教, 佛教, 道教和基督教. 启蒙, 涅槃和重生. 真实以及超现实. 数不清的隐喻和象征手法, 值得让人深思的背景设定和剧情. 我完全无法相信这是一部科幻动作片.",5
当时我就黑客帝国了。,4
这实际上是一部哲理电影……自此后子弹时间被多少片子致敬效仿……唉，基努里维斯，心中永远的男神。,4
打斗无力…,4
忙乱的思想，一切是真是假？｜2020.8.21 重看，人类才是这个地球最大的病毒。,4
最大的亮点是特工的病毒论，最尴尬的剧情就是装X墨镜慢动作，最大的bug是救世主设定，没有救世主，只有上帝玉帝佛祖🚬以及，尼奥是白雪公主吗，亲一下就醒😅,3
讨厌颠覆世界观的设定，母体栽培区真恶心。已经死了的男主被女主KISS一下就复生蜕变救世主，好吧人家是科幻你别当真。枪战戏好假，男女主角一身黑衣闯大楼太二了，慢动作更像恶搞。,2
就是各种酷。2001.1.12 vcd,5
酷就一个字！！！！！！！！,5
"9
一部非常出色的电影，被科幻外衣包装起来的唯心主义哲学故事。特效和讲故事的节奏感都那么舒服那么合适。在讲一个激动人心的科幻哲学的时候能做到如此淡定而不会伤了影片的节奏感，证明沃卓斯基兄弟的确非同一般。也正是这种有条不紊让这部电影的逻辑看上去比其它作品坚实很多。",5
这个哲学系列我只能看懂1,5
😍😍小时候看的，又重温了一遍，一直觉得里维斯秘制像王力宏😉真是有意思，导演已经从一对兄弟变成一对姐妹了,5
除了男女主莫名其妙的感情线外，这部片完全没毛病，难以想象这部电影居然是1999年的，绝对的神作！,5
虚幻永远是对人的致命一击，哪怕虚幻中尽是美好，因为人一有认知开始便追寻一种真实和意义。这也是为什么西方人永远无法摆脱对救世主的想象，无论是中世纪还是电子时代。或许这也是人生中唯一一类值得思考的命题。黑客帝国其实只是借了一个科幻的外壳，其对人机关系的想象本质上充满了基督教启示录和哲学思辨的意味。墨菲斯是“梦魔”，尼奥是“新”，崔妮蒂是“三位一体”。,5
为了这学期的信息学课，终于看了这个电影。好多对话最精彩。人编故事要编下去，总要用爱情这个最终的隐喻：）,5
叙事、结构都很庞大，这些人物对我没什么吸引力,3
74/47th 第一部是关于神化的智慧。第二部是男人的光辉与悲哀，以及意大利的传统家族观念在美国的狗屁价值观前节节败退,5
即使敌人已经手无寸铁，但仍旧要处理掉。麦克深深的延续了父亲的性格。唯一不同的是家庭问题的处理，是时代变了，也是麦克与父亲之间的不同。两条主线相互交错，即使对比更是互补。阿尔·帕西诺最后的眼神，那是寂寞吗？,5
两代人的对比，Al Pacino和Robert Duvall都太帅了，不同的是，父亲拥有家庭与荣华，而Al Pacino几乎失去了所有亲人。,4
个人感觉比1更好，可能因为格局更大的原因，导演的难度系数增加了不少。两代教父的故事以波澜壮阔的手笔呈现，一个是朝气蓬勃，一个是盛极而衰，最后却是殊途同归的孤独。经典修复的画质真是太感人了！,5
所以说，苟富贵 勿相忘是古今中外最难做到的六个字。仔细想了一下麦克和他爹的差别，一个是由穷到富的创业，从妻子到孩子到朋友到哥们弟兄，无一不是感恩的，跟着教父有肉吃。而麦克，只有他知道世界多危险，他一个人扛一个人摆平一个人承受，然后身边所有的人却把他看做是凶手和怪物，真可怜……,5
【720P】这部电影告诉我们，为什么“富不过三代”——因为富二代们的生活总是很混乱。,4
虽然有点儿长，但你会知道为什么三个小时你都坐在这里～（不明白自己2009年5月27日怎么留下了这样的短评，而且还被打了104个有用，毛用啊，对于回忆当时看完这片儿的感受一点用木有。2015.8.8重看，不如1爽，相比之下节奏氛围人物塑造都差了些，自然还有其精致所在但已经没了那种生猛，太可惜了）,5
帕西诺太帅了~,5
多年以后，垂垂暮年的麦克将会想起父亲生日宴上，弗雷多向刚刚报名参军的他伸出手的那个遥远的下午,5
交叉蒙太奇和结尾的闪回部分，让2的结构比1复杂了些。你是对敌人、朋友、亲人失去信心，还是对自己失去信心？想改变、想停下、想回头，却被无形的大手推着向前走的感觉，很难受吧？维多所期望的麦克的未来，是现在这个样子么？,5
阿尔·帕西诺不能再帅，是年轻时的代表作。,4
既是前传，也是续集，两条线交错着叙述，一边是创业一边是奋斗。无论镜头还是画面色调的处理都一如既往的出色。作为一部续集来说，堪称完美。但作为《教父》的续集，却始终缺了点什么……★★★★,4
又一看睡了的片,3
阿尔帕西诺你敢不敢再帅一点,5
《教父》系列的绝顶。对时间的感知是科波拉最出色的一次,5
三个多小时的长片却没有一丝冗余剧情，教父2比教父1艺术成就更高。横跨50年的双线叙述营造出真正的宏大史诗，冷酷英俊的阿尔帕西诺和德尼罗演技超一流，镜头和画面色调依旧绝佳，剧情安排让人唏嘘感慨，忧伤无奈的配乐震撼人心！只是如此完美的经典却有些过于残酷冰凉。（9.5/10）,5
差点屏射。alpha male之殇。你只是为了我们才佯装坚强，现在请允许我照顾你吧。我是你哥哥，我并不像他们说的那样窝囊。禁酒年代我们在加拿大运糖浆，卡车还是你爸爸的。我回以色列是想落叶归根，回美国是因境外不给寄选票。三代代代有反骨，钓鱼之前说声万福。稳重的剪辑渗透时代的厚重。服。,5
半原作半原创，半上代半下代，半圆满半破碎，半上升半下降。普佐在原作完成后趁电影的便利所做的故事延续，操控了两条时空错叙的故事线，在对照中做出了无解的命题。,5
看的心酸。一代教父从一无所有到朋友遍天下，有家族的荣耀也有家庭的温馨。可二代教父的一生注定孤独，他的决定在家族里格格不入：青年辍学从军，从军归来想过普通生活，不染指父亲的事业。然而父亲被害、妻子被杀，大哥鲁莽、二哥懦弱，逼着放弃个人的梦想而临危受命扛起了一个家族。在这条路上，又遭到哥哥出卖、妻子离开、妹妹仇恨，他始终都是一个人。电影许多个镜头给到阿尔•帕西诺，独坐在沙发一角，那么辛苦、孤独、坚强,5
从《教父1》到《教父2》，科波拉用镜头记录着两代教父权力的交接，也记录着第二代“教父”阿尔·帕西诺从一个男孩成长为一个男人的奋斗史。马龙·白兰度、阿尔·帕西诺、罗伯特·德尼罗，科波拉的镜头囊括了两代共三位教父，算是美国典型黑帮电影的集大成。,5
麦克失败的生活源于他表达爱的方式。,5
觉得比1更棒，Michael和Vito的根本不同在于Vito是一个地道西西里人、而Michael却是一个美国人,5
众叛亲离，独孤求败，成功代价巨大，罔顾亲情爱情；如果说第一代教父犹存道之风、家庭温馨，第二代时代在变，价值取向和处事手腕非同日而语；帕西诺和德尼罗双线并行，呈现历史的厚重感，两人皆魅力无穷；很多场戏都意味深长，指代并不晦涩，观众稍稍揣度就能体会到解读乐趣。,5
优雅的孤独,4
老科波拉，1974。al pacino确实很帅的，哈哈。不过故事太过美化了，拍的既不像黑帮片，也不像枪战片，也不像谍战片，也不像家庭片，也不像历史片，无法归类。,3
发家难守家更难，交叉剪辑两代教父更显张力，好戏错落上演。英雄式的维多和悲剧性的麦克，影史最喜欢的结尾那种孤独与无奈每次看都会动容，个人意愿与命运巨大的宿命感。更爱这部，还有那件丝绸西装。北影节资料馆4K修复。,5
“电影学院本科生必看100部电影”,3
#常看常新#在两代教父的平行对比中，Vito成为教父之前就稳重沉静，家庭观念强贯穿始终；Michael成为教父之后，变得越发阴郁狠绝，像刺猬一样防备着所有人。处世之道的变化让最后那段回忆如此令人唏嘘，最让父亲疼爱的孩子，最有能力想法的儿子，那个独坐桌边的寡言男孩，最终成为了孤家寡人的教父。,5
没想到标签的时候不能标意大利电影，而是美国电影,5
故事相当好，两条线对两代人，一个创业一个守成的比较，真是足以令人感慨万分。从小无父无母，受尽欺辱长大的维多，终于一家团圆，其乐融融，而从小在家庭的温暖中长大的麦克，却更自私，直至众叛亲离。当然除此之外，演员们对角色的诠释依然很棒，有血有肉，令人的观影感很好，结尾更是点睛之笔,4
【C＋】可以说是1的全面退步。完全陷入有佳句无佳章，不乏神来之笔但整体就是平淡无奇。1中最惊人的用光在2中所剩无几全靠调色，开场的宴会戏很明显是在拙劣还原1的开场婚礼，但最后只达到了拖时长的效果。新人物没有一个立得住、有特点，基本全是在啃1的老底。双线并行契合度并不高，老教父线仅仅起到反衬效果、更有趣的是老教父线居然还远胜于麦克线。这部将重心完全放在麦克个人以及家庭上，将其他一切完全摒弃，虽然成功塑造了麦克一人的孤独，但除此之外别无其他，甚至将1的黑帮史诗气质丢的一干二净。而在1中帕西诺和白兰度有对手戏反而因气度不同难分高下，2帕西诺完全主场后，倒时候看出其完全难以比肩白兰度真正的教父了。,3
"至始至终都是虐心的对比。""柯里昂家族""在麦克统领的时代里被误称为""柯里昂犯罪组织""，而道出此等侮辱的，便是曾经家父在世时打得火热的从政人员，难道这很晦涩？一个至少还会微笑，一个则冷血而情商低下，论事业无疑前辈逊色，然而后辈的威慑力只来源于理智，平衡家室与权势的男人才真正具备智慧。",5
必须承认三个多小时的观影过程是非常煎熬的，由于不能特别迅速且准确地将人名、人脸、台词进行有效对应，导致很多角色的言行举止理解无能，或许对这类电影确实存在某种认知障碍吧。但毕竟是影史经典，地位崇高，所以还是花了一番功夫反复去研习电影中的人物关系、行为动机等各种情节联系。德尼罗所饰演的老教父那条时间线理解起来还是比较轻松清晰的，主要是帕西诺要找出家族中叛徒的过程真的是得仔细梳理一番才能完全明白。值得一提的是阿尔帕西诺26岁时还是一名保安，周薪14美元，教父1片酬15万美元，而到了续集直接飙升到600万美元，本就是意大利西西里岛籍贯的他与片中麦克柯里昂形成极好的呼应。政客是用文明包装的黑帮，却比黑帮更加唯利是图，不管友谊与诚信，而二代教父为了洗白家族费劲心思，然而最终亲人接二连三离去，令人唏嘘。,4
Al Pacino把眼睛给了电影  Robert De Niro把灵魂给了电影,5
3.15 教父不会有第二个，时代不会重启。猪队友多，屎还不好擦。两个美国。,3
越来越觉得意大利文化语境下的「教父」其实与费孝通和项飙对中国传统社会概念中的「乡绅」叙述有着异曲同工之处：观照日常细节、擅作伦理判断，都着眼于对土地上生发出的规则与那套独立运行体系的维护。打小生长于西西里的维托尽管此后远走他乡，但已足够举重若轻地运用继承自土地的乡绅式思维对周边人恩威并施、功成名就；自小生长于城市的麦克则陌生于传统话语体系，即便对权力的认知力与控制力青出于蓝，但脱离了根源的熏陶，对挽救城市化进程下传统家族体系的崩溃依旧无力回天。,5
《教父1》是最伟大的黑帮片，《教父2》是第二伟大的黑帮片。,4
1、阿尔给阿尔帕西诺递毛巾，罗伯特和罗伯特德尼罗谈房租。2、马龙白兰度用公鸭嗓扮老尚可接受，但罗伯特德尼罗用公鸭嗓装嫩实在让人无语。3、罗伯特德尼罗的角色就是鸡肋。4、风格不统一，且这集放现在绝对会整成三部曲，200分钟都能这么多断层，还收得这么仓促，也算是开了眼界。,2
好看，一个家族的奋斗史，很写实，唉，睿智深沉又身负家族重任的男人真的很有魅力。,5
败在“刀疤”没有反派魅力！,4
我只是在必要的时候才会勇敢，勇敢并不代表你要到处闯祸。,4
“太阳所能照到的地方，都是我们的国土” 随时随地、再看百遍、都会感动如初的经典。,5
hakunamatata,5
经典之所以称之为经典正是因为他无法复制，狮子王就是这样的经典，每一个细节都那么出色，每个音乐都那么动听，恰到好处的搞笑和贯彻始终的感动。这样的片子不管放到什么时候都不会落伍，因为他本身就是传奇,5
最爱的迪士尼，没有之一。,5
动物版哈姆雷特,5
又是一部是属于那个年代的影迷的经典,5
经典得都烂了,5
现在看剧情真的好简单啊，不过拟人感实在太完美了。还有那个“哈库那莫塔塔”，好多年没听到了...Can You Feel My Love Tonight？,4
从此得知，原来动画片还可以是这样的……,4
这部动画绝对是经典，内容积极向上，音乐无可挑剔。,5
我真的不覺得特別。,3
勇气与成长的故事，即使过了多少年，即使生处不同的时代，仍旧能够让人有所感悟……辛巴是在波折的人生中踏出了那条成王的道路！,5
应该是我看过的第一部迪士尼动画电影，还是看的英文版的，绝大部分句子没听懂，光看画面当年就觉得很惊艳！,5
重看，这一部当是Disney Classics的集大成之作了，汉斯·季默、埃尔顿·约翰联手为其锦上添花；另外个中暗含的隐喻也很值得玩味：刀疤在鬣狗领土密谋造反后检阅那场戏，简直就是照着《意志的胜利》扒下来的，哈哈。,5
现在看来，迪士尼不愧为业内的领头狮，可能故事上并无太多新意，但形式上却极其亮眼。讲究的制作，考究的细节，甚至还将歌剧元素融进了作品(这点至今看来还是很让人惊讶)，各个角色依旧出彩（个人尤其喜欢那只狐獴，太Q了），保持着高水准视听的同时，亦流露着它的非凡厚度：但当太阳升起 在这湛蓝的天空 伟大与渺小 永不止息的轮回 这便是生生不息 它驱使着我们步行远方——这才应当是人类展现予后代的作品啊,5
这已不能用一部电影来衡量，这是一种回忆、一个童年，就像失而复得的初恋，那么弥足珍贵，那么心潮澎湃！,5
又是一部是属于那个年代的影迷的经典。,5
一部比大部分真人电影还优秀的动画片。,5
这动画说的是龙生龙凤生凤、狮子王的孩子还是王；野心家的夺权、王子的复位，以及童年情愫、成年的炮。这动画加分都在技术项，比如使用了当时最先进的2D动画技术，现在看来极具美感渲染的画面，以及太经典的歌曲，《Can You Feel the Love Tonight》一曲足矣！8.4,4
非常经典的动画片，老少皆宜。看的时候会忘了这是动画片。,5
重温童年经典，依旧好看。故事内核是动物版的哈姆雷特，但主题由复仇改为偏重对成长与责任的诠释。严肃黑暗与滑稽温情完美平衡，一部成人和儿童都会拍手叫好感动不已的经典动画电影。配音出彩，抓住了角色神韵，Hans Zimmer的配乐大爱。（9.0/10）,5
四星半吧…真的很喜欢…小时候看的…还看哭了哈哈哈…和家人每次说起The Lion King反倒不是提起辛巴…而是那三只hyena（好像是狗吧没记错的话）…被质问的时候第三只点头的笨蛋样子太深刻了哈哈哈…,4
C / 单论剧本原版未必要比真人版好，有几处的转折还要更生硬。但是动画的优势实在是太明显了，从第二场戏开始气质就完全不同。主要的几个人物都是由丰富、夸张甚至是妖娆的“姿态”连贯而成，加上几个华彩段落的视觉表现力，整部片富于狂欢感的节奏一下子就充实了起来。不过这把年纪看余味倒也没有多少……,4
台湾佳译影院译制的，非常用心的翻唱了所有曲目，相当不错。不过故事就次了点儿。,3
土狼纵有千般厌点，但至少——兄弟齐心，绝不内斗！特别考虑到本故事主题核心便是取材于文学史上的内斗极品哈姆雷特，就更加反衬出……等等！为什么绝大多数观众并没有感受这种“反衬”，而是几乎完全按照影片设定好的善恶轨迹去移情狮子厌恶土狼？只能说明本片编导狡诈地更或者是无意识歪打正着地充分利用了土狼的丑陋猥琐外在形象彻底主导了观众好恶心理，以至于“土狼远比狮子更团结”这个主题动向上形成的叙事偏差也被掩盖住了。试想一下换作魔戒双塔决战圣盔谷，此节主题重点之一展示“勇气”，而城内飞石从天而降，强兽首领怒吼一声纹丝不动……,4
动物版的《哈姆雷特》。,4
现在回头来看，已经很难从这种二元化的作品中找到感动了……,3
小狮子王辛巴在朋友的陪伴下，经历了生命中最光荣的时刻，也遭遇了最艰难的挑战，最后终于成为了森林之王的故事。,4
狮子王实在也是很喜欢的,5
都说是童年回忆，但我一点都不记得小时候看过。还是大学的时候和同学一起看了一遍。,4
"傲慢與偏見。父權體系、選民意識與精英主義。洗腦式教育、自我意識的泯滅、極其表面的「非洲元素」堆砌之下明顯地缺乏想像力的爛俗內核。

一面冠冕堂皇地高唱「Circle of Life」，一面對鬣狗這一整個物種進行肆無忌憚的醜化抹黑與邊緣化，堪稱種族歧視。

最大的bug是，獅群是母系社會，並且根本沒有王位世襲制這回事兒。。

三星給畫面和音樂，迪士尼再見。",3
好看，温馨，励志,4
正义总能战胜邪恶，在你经历坎坷之后。原声音乐也超好听,4
童年回忆，动物版《哈姆雷特》，哈哈，故事很励志，小狮子辛巴很招人喜欢,4
"电影开场，一声嘹亮通透的非洲土著语划破寂静，传入天际，随后红日缓缓升起，照耀在广阔的热带草原上，犀牛昂首、狐獴四顾、猎豹雄视、象群前行、大雁过空、麋鹿跳跃、斑马奔腾，一同汇聚在雄伟的荣耀石前。
伴随着Carmen Twillie沉稳而绵长的歌声，镜头移至荣耀石上睥睨天下的狮子王Mufasa。在阳光普照下，在动物的瞩目中，手拿法杖的山魈巫师Rafiki将狮子王的孩子Simba高高举至头顶。此刻，所有的动物欢呼雀跃，对未来的统治者俯首称臣。由Elton John谱曲的《Circle of Life》也在这生命轮回的一瞬敲下最后一个音符。
——也许这就是许多人对《狮子王》最深刻的回忆。",4
哈姆雷特中的复仇小王子变成了丛林中的狮子王，原始森林的广袤无垠凸显了一种雄壮的气势。,4
跟着我侄子一起看的还不错,4
绝对称的上经典之作，小时候只要电视播放我就看，现在给儿子看，喜欢辛巴！,5
看的我很愤怒。他们发生了，但他们正视了,5
除了中国和北朝鲜，世界上真的有互联网这个东西。,5
煽情部分的话，其实回忆更感人。其实韩国的八十年代是很有看点的，这些年也有多部相关影片出现，从军政府到如今，卢武铉的经历恰好也可映射出韩国的民主进程。,3
药神应该借鉴了这部电影,5
“国家”是什么那一段太精彩了，饼叔赞！,5
法庭抗辩情节太一般了。但有一点把握得特别准确：一个生活优渥且一心想着赚钱的人，你跟他讲再多民主斗争的大道理，他都可能不为所动。突然有一天发现，哎，那个被抓进去受虐待的就是平时卖猪肉汤给我的大娘的老实巴交的儿子，认识的人。一瞬间就变民主斗士了。。。,4
熔炉，素媛，辩护人……最起码在电影领域里，我们没有资格嘲笑韩国。,5
简直就是现在的中国,5
今年韩国的超级卖座片，也是我愿意推荐给所有人看的电影。他们所曾经经历的公权之害，我们一直在经历，但是韩国人能把它拍成电影，让全体国民在影院里反省和缅怀。剧作实在太扎实了，宋康昊的表演无比强大，今年又要横扫各大奖了。,5
分数偏高，或是因为题材的讨巧，而非技法的流畅。,3
依然可以找出不少瑕疵，却仍旧要感叹韩国电影工业的日趋成熟，似乎随便一位新人导演就能讲述出令人动容的故事，除了体制之外不得不承认创作态度的天壤之别。生逢乱世明哲保身往往只能是一种奢望，而很多时候恰恰是我们事不关己的冷漠态度在纵容着罪恶的发生。,4
《中华人民共和国宪法》第一章 第二条　中华人民共和国的一切权力属于人民。第五条　中华人民共和国实行依法治国，建设社会主义法治国家。我永远热爱我伟大的祖国！,5
表演太棒了，尤其前面的漫长铺垫。进入主节奏后在情绪的推动下庭审细节有点粗糙，个人英雄主义的渲染过分浓烈。作品在社会意义面前还是急躁了，但不妨碍它成为一部里程碑式的作品，由此来观察韩国社会及电影业二十年的飞速发展。,4
题材的讨巧和话题性盖过电影本身，煽情太过，影像一般，前半段更好；庭戏的镜头那叫一个绚丽，都360度转圈了；没有真正的结尾，正如没有真正的所谓民主，有人之处就有极权。,3
一直觉得韩影与韩剧是两个极端，前者可以重如泰山，后者足够轻若鸿毛，所以我始终是韩影拥趸。本片题材放在中国来是几乎无法评论的，只能说看的时候就像在照镜子一样，越照越显出对方的伟大和自我的扭曲。宋康昊自共同警备区一片引起我的注意，孝子洞理发师、杀人回忆、密阳等片一路走来，演技已臻化境,5
证人所说的国家只是强制取得政权的一小部分 振聋发聩 看完这个电影感觉世界好像没有变 1980年发生的事情 到了2020年还在发生,5
确实是“拍的内容”比较高级。不过类似内容在二三十年前的西德和东欧电影中就已经到处都是了，我朝为什么只有在面对韩国电影的时候才能发现自己的文艺工作有多落后？,3
比《恐怖直播》那种胡编乱造好很多。,4
人生不能像做菜，把所有的料都准备好了才下锅。还有就是，原来男人会一直有性欲。,4
看似最不能守住传统和孤独的人，坚持到最后。,5
看到最后，原来是老爸最猛~~,4
李安真是个闷骚，想骚不敢说，但又骚得难耐，只好骚得若隐若现，骚得欲说还休，把他那五千年来的性压抑骚成一套吃饭故事，一如他上台领奖，本是春风得意，却把脸摆成一幅认怂的样子，但再怂也掩不住嘴角的笑意，尼玛，我从未见过如此闷骚之人！,4
