Review,Rating
日本人过得细腻，连菠菜都要剥筋。吃货女汉子的清新文艺生活，自给自足舒服自在，还有萌喵陪伴，我也想要啊！不过她靠什么维生？原声清新小电子，这居然漫画改编,5
画面很美，立意低下，一部满足城市观众好奇心的做菜大全。以猎奇心态拍日本乡间，电影语言接近零分。请氧气美女当主角显然是想把文艺青年吃得死死，这种直白的工心计怎么对得起这静谧的自然？好想操起“岁月的童话”就砸过来...,2
基本只有看睡跟看馋两个结果，看了就知道了,5
糖衣炮弹。,3
当成舌尖上的日本看了。,4
不要讲什么道理和原因，只是自闭症发作要过自己一个人的生活不是很好吗,4
做這麼多吃這麼多，不胖的法子就只能是下地幹活了,4
生活的本质是孤独，还好看了这部电影,4
接受了度过发育关后的桥本爱，就可以看小森林了。夏大片的绿，哗哗作响。人藏在大自然里，日夜劳作，流下必须的汗。不用进入等在那里的黑夜。夏夜来访的朋友，柿子串成的幕帘，心事藏入深渊。从水里捞出冰凉的西红柿咬一口，只呼吸今天的空气，只面对今日的太阳。,5
爱酱脑残粉当然要打五星啦,5
年度十佳预定，生活是什么样子不重要，重要的是生活的心情。,5
类型：剧情？？？,4
有节制有分寸，四季不长不短正好，在拍下去就得审美疲劳了。,5
一餐一饭治愈片。我要是自己去乡下劳作会饿死的吧。还是努力工作吧。,5
如果我长桥本爱那样，那讲真，这样的日子我是不甘心过的……但是里面的每一道菜都想做！,4
穿越界第一女朋友:Rachel McAdams; 喜欢这部片子的光感，最爱大雨如注的那场婚礼，你紧张地问我，是不是想要一个阳光明媚的婚礼，不不，一切不需要重来，一生只这一次就好。,4
突然悟出一個道理。分分合合的戀情，多半因為其中一方熱切於go back in time，重臨兩人曾經的過往。而另一方並不。,4
理查德·柯蒂斯擅长的轻松有趣加温情。时空旅行仅是噱头，重头还是亲情。当主角发现即便可以时空旅行，仍无法避免那些生活的悲剧。比如亲人的离去，我们始终无能为力，这恐怕是最触动我的地方。最终的主题仍是学会爱，学会生活，并珍惜与亲人的每一天，这话说来容易，实际却相当难。生活中同样应该如此,4
对于我们最爱的人，不说永远，只说珍惜。差点在电影院哭断气,5
被初恋诱惑时，竟然是拒绝后第一时间回家求婚，这个真是犯规了，太感动,4
你们有没有发现，所有的时空穿越的电影和书到了最后都在告诉我们，要living in the moment...最朴实庸常的时刻也是美好的,5
1、三观够正，道理积极；2、故事想法很有意思；3、原声配乐很好听；4、剧本有问题，过度弱化冲突，故事本身除了舒服外没有说服力，life is much harder；5、太多旁白只说明剧情推进的乏力；6、镜头不时莫名其妙地晃；7、片子质量有三分，给到四分是私心,4
可能是为了卖片，包装成穿越爱情故事，为此差点错过此片。谢谢贤妻的死拉硬拽。虽然中间说了几句这不合理，但真的很好，上了年纪的人，给我们上了一课，关于时间，关于人生，好像还关于电影，那个黑暗的小屋，何尝不可以是电影院。,5
奇怪的是，回到过去这项超能力，最终教会我们的却是头也不回地往前走。,5
以为它是软科幻片，结果一开始的感觉，它是个喜剧片，紧接着你发现它是个爱情片，然后你发现它个伦理片，最终，你发现它是鸡汤片。不可否认，这鸡汤还是挺美味的。,3
"编剧是Love Actually的Richard Curtis, 女主角是来自于另一部时间旅行电影The Time Traveler's Wife的Rachel McAdams. 配乐沿用了Gravity里的钢琴伴奏，画面美好到让人陷在爱恋中。在伦敦，若不好好谈一场恋爱就太辜负这个城市的一片深情。把每天当作最后一天般珍惜度过，积极拥抱生活，就是幸福。",5
"""How long will I love you?""情节退后一步，把舞台留给家人、生活，留给错失爱人时的惊惶、表白时的笨拙不安，留给最后一次海滨散步、最后一次拥抱、最后一个吻。每天过两遍，会发现被忽略的美好；孩子养三个，万一某个太聪明笨笨的两个可以作伴。片名有点误导，画面美歌好听，一家人在一起真好。A-",5
“我试着过好每一天，就像我已经穿越回去那天一样，去享受它，当它是我非凡却又普通人生的最后一天…跌跌撞撞和摔倒都造就了现在的我。” 扔掉可反悔的《人生遥控器》，过好每一天！50%的浪漫爱情+50%的家庭亲情和人生感悟，不如《真爱至上》《海盗电台》浪漫的彻底，却也直抵人心。打个俗分4星。,4
关于时空穿越的“技术流”问题不少，但是作为一部有笑有泪又有爱的心灵鸡汤片该做的也都基本表现到位，尤其泪点深得Eternal Sunshine of the Spotless Mind和The Curious Case of Benjamin Button之精髓。,4
时空穿梭在片中不过是一味调剂，完全没必要深究所谓的逻辑。生命中发生的一切都有它的意义，总有些事任你如何通天彻地也无能为力。时光总在前行，生活终要继续，纵然历经风雨，只要用心感受仍会发觉其中美丽。每一天都是独一无二的旅程，无需任何修整与调试依然可以走出无与伦比的人生轨迹。,4
我其实觉得这片里每个所谓bug都是为了一定的用意不得不存在的，而超能力也只是用来传达主题的工具而并非主题本身，不必认真追究。爱情喜剧有风景、音乐（真的很棒）、笑点、泪点和对生活一点点更多的感动和希望就够啦，更何况还有那么疯狂的婚礼和好可爱的男主角呢！,4
可以看得见风景的房子，大雨掀翻帐篷的婚礼，每天除了打水漂就是在海边喝茶的生活多美好！好吧，就算穿越这个梗bug百出，也不阻碍我们从中get一项活得轻松一点的技能：如果你的今天恰巧跟昨天一样无精打采或倒霉烦躁，那一定是上帝给了你一次再努力做得更好的“穿越”机会。So，enjoy it！,4
"是放在硬盘里很久了的电影。今天无意间看起来，却意外哭得撕心裂肺。比起片中的爱情，更让我触动的是男主与父亲的亲情线，看完电影马上给父母发了我爱你。 btw,仔细想了想，我庆幸自己没有回到过去的能力，否则可能也会不由自主的修正每一段回忆，但其实正是这些遗憾的笨拙的回忆造就了我，让我是我啊",5
编剧的笔尖犹如乐团指挥家手中的棒子，弹指之间，我们的欢笑与泪水全然失控。每一首配乐，每一段对白，都是如此触动心弦。,5
柯蒂斯说这是非常私人的一部电影，的确如此。片子就像一篇小学生的命题作文，“假如明天是你的最后一天”或者“假如我有穿越时空的能力”，所以剧情方面来说，是没有太多新意的，但生活的温情细节足以打动观众，尤其前半部分，笑料很密集（相比起来后半部分就有点说教了）。除了爱情更多是亲情,4
对真爱至上/海盗电台都无感的我，自然也喜欢不起来他的这部新片，受不了这种非要在Chick Flick中探讨人生的刻意感，好几个小清新的煽情段落都可以直接用来当心灵鸡汤式的公益广告了，配上干瘪的说教更是雪上加霜。时空穿梭的BUG实在碍眼，“再来一次”的笑料也过于重复，OST好听到让我不断出戏。,3
冲着女神违心给四星。。。,4
这个故事emm……这么说吧，一个做错事后可以选择重来的人没什么资格教导别人去积极生活。,3
豆瓣上最被高估的电影之一，时空穿越梗做得烂。它就像一部有亮点但总跑题的作文，开头是爱情，后来拍亲情，最后成了一部鸡汤味的家庭伦理片。影片逻辑也是摇摆不定，一会儿情感无法左右，然而男主真爱就是套路的结果。一个缺少性魅力的废柴，因为在第一重时空了解到女主的信息，通过时空穿越，成功抱得美人归。他设定的人生，真的是女主想要的婚姻吗？当然，没有笑靥如花的瑞秋·麦克亚当斯，时空恋旅人会更让人难以置信吧。,3
选角美，配乐美，造型美，镜头美，剧情美，台词美，这样一部让人心情好的电影，我都快忘了爱情事件多美的事儿了，可电影不仅仅只描述了爱情，还有温馨的家人，给一百颗星都不够！Rachel这样可人的女孩，要遇到了我一定会去追 ❤,5
最最泪目的，大概是男主最后一次穿越回小男孩时期和父亲最后一次嬉戏玩耍吧……,5
每一天都是最好的一天，超棒！,5
这片子评分好高，最起码说明我们还有柔软可以被触动。,4
看完觉得主角太幸福，后来想想又有谁可以让时间倒流呢，还不是一步踏错悔终生,4
父子戏才是主线....五星全给海边散步那一小段,5
挺失望的，可能几年前看会感动，现如今只觉好一碗爹味浓郁的直男鸡汤。,3
不懂，这片儿凭啥进的250？,3
我以为只是一部求婚大作战，但没想到一下讲到了很重的人生，很感动,5
平淡如水的人生剧 一点点科幻成分 软到几乎不存在 但却在临末尾时起了点睛作用 大部分超能力片的主旨 都着力在能力运用上 Tim则在父亲的帮助下 慢慢领悟能力局限 感激温情和亲情 最终淡然处之 尤为难能可贵 哈利波特里的双胞哥 老戏骨比尔奈伊 可爱的小女孩 这三个成分对平淡悠长的剧本给予了很大加成,4
电影的重心一直在变，从软科幻片到爱情片再到亲情片最后的落脚点是鸡汤片，一部电影有多种元素类型的组合包装是很正常的，只是前后的表达重心应该尽可能一致最好。作为时间旅行的素材，导演也回避了很多观众自然会产生的疑惑，比如倘若父亲和儿子都穿越时空的话，到底以谁的时间线为准，如何避免时间线的混乱？还有一旦回到过去后，能否再马上回到现在？当然瑕不掩瑜，男主每个家庭成员都充满了人格魅力，最后给出的生活态度也是大多数人应该去追求或者学习的。有时候，我也无比想穿越到某个节点，重启一段人生，前提是可以带着这几年的回忆。,4
I believe in love and try to find someone kind to marry,5
上帝给予了你超能力，不是一定要让你去拯救世界，而是要让你去热爱这并不完美但充满美好的平凡生活。,5
哭成狗，，，，哭成狗，，，，抱着枕头哭成狗。。。。。。,5
达伦，你到底从今敏那里偷了多少灵感，这和《黑天鹅》的设定有很多相似之处啊！镜子的割裂，心理暗示，散碎的剪辑，真他妈牛逼。,5
片子结尾将一切坐实为留美所为不能不说有丝遗憾，其实我个人更赞赏影片60多分钟时的那个剧情构思和说法，即，之前所发生的一切只是一个名叫高仓阳子的平凡女子的人格分裂，把自己幻想为偶像歌女雾越未麻，把自己不堪回首的遭遇幻想成在演戏，藉此得以解脱。,5
谁说今敏不牛b我跟谁急,4
好的剧本就是就算你猜到了结局也猜不到全部,5
看今敏解读，他自己提到《梦之安魂曲》里浴室镜头的模仿：“什么致敬，明明就是抄袭！那个坐在浴缸里的女主角就是詹妮弗·康纳利。后来我还和她坐过同一架飞机，结果她在头等舱，我在经济舱。”哈哈哈哈哈哈,5
強姦戲可以理解，拍裸體寫真就絕對是敗筆（雖然是留美發瘋的關鍵），這樣一來未麻的演員定位就有問題了，到底是實力派呢？还是三級片明星呢？,4
边看边起鸡皮疙瘩，但看到结尾为什么觉得很励志……电影海报是神作,4
梦境 现实 虚幻 穆赫兰道的感觉,4
惊艳，这片子夏天看可以降温。,4
想想看这才是1997年的动画电影！今时今日很多真人电影仍然无法比拟它的用心良苦、诚意、和所达到的效果。为了扑朔迷离，今敏用尽心思。,5
"又是一个精神病,ME-mania长得吓人啊,恐怖..动画不是给孩子看的.,,",4
浮生暂寄梦中梦，世事如闻风里风。,4
这绝逼不是给小孩子看的动画,5
日本人真会扯，日本偶像文化之变态写照。虽然今敏这部动画各方面还算可圈可点，但由于悬疑类书籍阅览过剩，这个结局在片子中段就被我猜透了。,4
惊悚得头发梢都立起来了，今敏就是动画界的大卫·林奇啊！虚实切换得让人叹为观止～,5
97年的创意极度了不起，真实和幻觉之间的转换迷人而可怕。比较苛刻地挑一个刺是人物性格的塑造较为粗糙，题材选择太过梦幻，减少了“真实得可怕”的力度。,4
这就是那种即便导演给有一个看似“封闭”了的结局，也依然完全“开放”的片子。任何一种诠释都可以成立，也都无法彻底成立。,5
最好看的今敏。一个细节，所有被杀的人都是被刺了眼睛。,5
今敏大师导演的第一部动画，原来就如此牛逼！与之相比《黑天鹅》简直如同一个拙劣的模仿者。人格的分裂，梦境、戏剧和现实的混淆如此诡异、出色，只有动画……不，只有今敏的动画才做得出来！凌厉的剪辑令80分钟里观众时刻紧张万分。不停的思考情节和人格的真假。浑身冒冷汗。黑天鹅弱爆了！//20180923SAME法文展映。时隔多年再刷，买了原画分镜设定集，又看了今 敏的书了解了制作的来龙去脉。在影厅里依旧看得头皮发麻。除了因制作问题在作画方面有瑕疵，在剧情、分镜、音乐上堪称完美。梦境与现实，真实与虚幻，人格分裂、戏中戏……环环相扣，大师处女作即展露出尖锐的锋芒，已能看到后来作品的影子,5
表现人物扭曲的方式：眼距加宽。,5
高度写实，心惊肉跳！,5
远超盗梦空间或是黑天鹅，风格接近妄想代理人。一个人的执着，两个人的精分，三个人的迷失。人格分裂，精神分裂，虚拟与现实，演戏与做梦，对过去的自我否定，丰富的细节和高完成度使它可以有三种以上的真相解释而且都站得住脚。复杂的剧情又比同为玩蒙太奇的千年女优更值得回味和讨论。非常牛逼。,5
这个还真的比 红辣椒 和 千年女优 还好····  说什么不如黑天鹅的，搞笑么···（顺便说下 原声配乐 挺牛的··有好几处 非常具象音乐）,5
后半截mind-fuck得太厉害，以至于到最后任何一个镜头都在怀疑其虚实。20年前的作品，现在很多“烧脑”电影能用到其中三分之一剪辑功力都已经不易。,5
这种精分电影其实看着挺累的...,4
如鲠在喉。,4
看完了，就像上了一天班一样累。,4
个人也认为前几个被害人都是未麻自己杀的。,5
二十周年重映版。今敏太厉害了，且不说这部电影启发了多少好莱坞导演的作品；中后段未麻进入歇斯底里的状态后不断地从一层层的梦境中醒来，我只想抛弃一切逻辑和分析和她一起掉入毁灭的深渊。虽然结尾有些突然，并不能解释所有的疑虑，但电影已在制造困惑、把人内心深处最大的恐惧挖掘得淋漓尽致。在日本当爱豆应该还有好多故事可以讲，很希望多看到一些,5
我开始同意：牛逼的电影人都是从处女作就开始牛逼的。令人毛骨悚然的心理电影，在今 敏作品序列中最具现代感。画风尚没有生涯后期狂狷鬼魅，但想象力和表现力（蒙太奇切换）已经如入无人之境。变换视点令观众感同身受，以至分不清现实与幻想的界限。刷完四部长片以后，认定今 敏是我最爱的日本动画大师。,5
不知道还会不会出现一个能把动画片拍得如此迷人的导演。,5
81分钟，今敏只用了81分钟，就完成了大多数知名导演，120分钟都不足以完成的信息量，这复杂而又烧脑的剧作，被安排的如此紧凑，叹为观止。,5
20年前的作品，放到现在依然不过时甚至是超前,5
男人认为摧毁一个女人的精神，不是强奸就是裸照，把身体羞耻通过镜头刻进女人脑海。反观影视作品里被摧毁的男人，丢工作、家庭破碎、身体残缺……却很少有关于身体的性侮辱。剧情和画风不错，但我不喜欢大肆渲染的强奸戏和裸摄。未麻作为偶像和演员，定位都绕不开男凝。结局一般，虽然冠以自我成长的主题。不会看第二遍。,4
我很喜欢这个片子，看了很多遍。,5
不只是《黑天鹅》，更是《穆赫兰道》。,5
谁来告诉我用动画代替真人电影中的悬疑惊悚精分什么的具有什么优势？我认为动画就应该尽其本分，表现童话神话之类的狗屁，不应该承载真人电影的使命。诚实地说这片子我看不进去，动画的形式大大削弱了我的兴趣。今敏不是不牛，他的回忆三部曲就明显是合格的动画，比这个好,2
看似少女偶像的幕后生活，蜕变和觉醒的过程，却是每个想要摆脱平庸生活的人的挣扎，画风，音乐，剪辑，氛围，故事，都是一流的，超乎寻常的想象力，每一格画面都有独特意义，不仅仅是一个人格分裂的惊悚故事，更像是一个关于梦境的哲学命题。最后，女主角醒了吗？真醒了吗？达伦·阿伦诺夫斯基的《黑天鹅》《梦之安魂曲》学了本片很多东西。,5
其实与原著相差挺大，但是记忆里第一次窝在被窝里看到赫敏走下台阶的那刻惊艳永远不忘。凭着这个都愿意给5星,5
不管是书还是电影，火焰杯都是最好看的,4
这一集真心不错，青春期对异性的朦胧感觉切入，男生女生之间微妙的心理变化。波特接受挑战，内心开始成长。伏地魔复活，黑暗来临。好戏刚刚开始。片子还是感觉长，但因比较细腻，所以没那么无聊，说实话比赛好没劲儿，还好又节省的部分，从第三个比赛才开始紧凑起来。三星半,4
哈利波特系列最喜欢的一部，剧情最吸引人的一部。另外，克鲁姆很迷人。一如既往地爱着罗恩。,5
感觉拍得最差的一部。初三在影院看完后你还找我借了书，记得不隔天上课时你捧着那本漂亮的绿皮书向后侧过身子指着描述穆迪假眼睛的那段对我笑得合不拢嘴。你让我多想亲你你知道不？,4
每次看到第二轮比赛的时候哈利的珍宝是罗恩都笑翻了过去！,4
英国人把冒傻气的哈四演绎成了绝妙的青春戏剧，三人组的吵架，亲密得让人不好意思起来。而我最喜欢纳威。,5
目前为止这部最好看，不过可以想象书应该更精彩，尤其是斗龙那里,5
舞会上赫敏出场那一瞬间太太太太惊艳了！！！三强争霸赛也有诸多亮点，虽然这是进入黑暗基调的起点..,5
最喜欢这一集的魁地奇大赛,5
150分钟的片子还是感觉太仓促。一些场景、道具比想象中的要简陋。,3
位于「哈利波特宇宙」中段的第四部也是从儿童轻喜剧冒险类转向青年成长阵痛向的关键点，伏地魔回归 / 哈利波特首次面对关键角色死亡，都是下阶段的伏笔和引线，英国演员群贡献了惊人的龙套群——从大卫田纳西到青葱时代的帕丁森。,4
看这部的时候还没有看过原著，觉得挺精彩的,5
"小的时候看伏地魔重生被吓到咬（表姐的）手，现在看只觉得伏地魔超萌的。活过来就一直没鼻子傻笑，坚持正面单挑。结果傻了吧，人家能场外求助。倒是哈利抱塞德里克.迪戈里尸体回来死不撒手地恸哭，迪戈里爸爸茫然地喊着“That’s my son, that’s my boy”骗了我好多眼泪。",4
私人最爱的一部，场面宏伟，情节曲折，竞技场充满了有趣的看点和耸动，这部电影开始死亡开始赤裸裸的在波特面前发生，心疼塞德里克，成了伏地魔又一次虚张声势的脚下亡魂…,5
全员长发造型真是欣赏不来。哈利带着学长身体回来全场爆哭我也狠狠流泪。另外两个学校的出场太会了太会了。魔法部长儿子跟蛇一样吐信子笑死我啦,5
罗伯特帕丁森因此火了，哈利已经被拉下了神坛，最终长成了一幅没有存在感的眼镜儿。新八君还是回去银魂的世界吧，乖！但总体来说还是比后面的大卫叶茨的后面几部好很多。那些马车和船还有那些动物的造型都深得我心。,4
这一部真心好，系列里最优的一部，人物之间的关系，角色的内心，大的场面都有了，而且做好了承前启后这一环，不像其他系列的中部，简直就是过渡段。,4
"电影里头，说起来我事实上最喜欢的是这一部，不管其它什么——就为了赫敏穿着粉色礼服从楼梯上走下来的那一瞬间。
so u， my little princess。",5
我最喜欢的系列小说就是第四本，电影是第三部。和当初借我哈一到四看的张喆交流，他最喜欢的是前两本。童年回忆也是各有千秋。看第七部之前真应该把小说都看完，不过迟到的补救，总好过无动于衷。,5
整体还是比较流畅的，其实故事逻辑有几处比较生硬，但是不影响观影。这一部算是哈利波特世界的一个转折点，黑魔头复活，有人死了。14岁的哈利突然要被迫承担不属于他这个年纪的重担，整体节奏就开始走向阴郁的英伦风了。,5
初中看的“哈利·波特”系列小说也就看到了这第四部，而这部电影之前在Star Movies上看过一次，现在重新看发现了一些熟面孔，有罗伯特·帕丁森，还有拉尔夫·费因斯演的伏地魔，不过特效把他的脸弄得那么模糊，都认不出来了。片尾字幕才发现电影原声居然有Jarvis Cocker唱的歌,4
"《哈利波特火盃的考驗》延續第三集《阿茲卡班的逃犯》故事，主角丹尼爾域基夫飾演的哈利波特，被神秘挑選參與著名的「巫師大賽」，他將要面對來自霍格華茲及兩大歐陸巫師學校的高材生挑戰。與此同時，邪惡的佛地魔終於現身，他的支持者於魁地奇大賽中發出Dark Mark訊號，預示了佛地魔黑暗力量將再次重臨，令魔法世界陷於一片惶恐之中。哈利波特既要面對這邪惡力量的挑戰，同時踏入青春期的他，還開始要為約會異性而煩惱。

導演 : 米克紐維爾演員 : 丹尼爾域基夫,魯拔格連特,愛瑪華生,賴夫費安尼斯,美蓮達李察遜",4
完全不记得我看过这部，完全不记得嫩牛五方打过酱油= =这部剧情有点平淡，赫敏演技还是夸张派（但我喜欢这个聪明的学霸菇凉- -），哈利还是面瘫派，我最爱的还是ron的演技~看起来太舒胡太自然鸟~新的Dumbledore有点不是太慈祥= =老是有错觉是反派,4
在《哈利·波特与火焰杯》中，神秘和悬念与青春期的幽默和心碎交织在一起，除了要面对仇敌、竞赛、拆台和嘘声之外，哈利还要物色圣诞舞会上的舞伴，可是任何魔法都无法消减青春期的萌动。制作人海曼说：“这个故事中最精彩的一面就是哈利和他的伙伴们开始对异性产生兴趣，一系列尴尬也由此而来。迈克·内威尔具有着出色的幽默感，而且天生就能很好的把握喜剧时机，所以看到这些孩子努力互相交流真是让人觉得痛并快乐着。”,4
看过不知多少遍所以似乎没有标记的必要了,5
发型和服装交给演员自己乱搞的结果...,3
选角的糟糕抹杀掉了其他方面的所有努力。更何况……剧情推进太糟糕了，丢三落四紧赶慢赶要把一本书挤进一部电影里从此成为系列标配。,3
不错～小时候看的书记忆里就是印象深刻～一边看一边还能想起不少名字～曾经万千宠爱的屈臣氏小姐如今演技被黑出翔了……现在的嫩牛五方原来一路走来tagged handsome。有些事情不需要较真，且看风云～,5
相较前几部，本部的特效和摄影可谓大升级。单场戏的戏眼和趣味也更为成熟丰富，符合当代观影习惯，有的莫名其妙的笑点设计，甚至几度笑出声来。最反差的是，邓布利多在这一部突变话痨不安综合征，那动作，那肢体，大起大落，大俯大仰，大开大合。刚看不习惯，看惯了才觉得以前的邓布利多太过紧绷，束之高阁了。有些改变，其实还蛮不错的。,4
第四部确实拍的不错哦。。内容范围都衍生许多。。虽然演员还有许多不尽如人意地方。。但赞。。,5
剧情那个拖啊，基本就最后那20分钟有价值，剩余时间在讲一个纯粹为了娱乐大众的一不小心就会要小孩子命的毫无意义的比赛，最后那个破奖杯还是被施了咒了，然后一群人知道伏地魔回来了以后也完全不怕为学生草草开了个追悼会以后照样笑呵呵地过校园生活，演员也奇葩，硕大一个女校选出只恐龙来,3
搞P啊！DT的戲份也太少了！,3
